lit_id,target_ref,source_book,source_chapter,author_ref,quality_rank,source_text
lit_879aeb00,萧放,《历代名画记》,卷八 北齐,张彦远,,萧放，字希逸，梁武帝犹子也。为本朝著作郎，入齐待诏词林馆。善丹青，因于宫中监诸画工。帝令采古来丽美诗及贤哲充画图，帝甚善之。与杨休之同撰《御览》。加镇东大将军、散骑常侍。见《北齐书》。
lit_1099cdb1,杨子华,《历代名画记》,卷八 北齐,张彦远,中品上,杨子华，中品上。世祖时任直閤将军、员外散骑常侍。尝画马于壁，夜听蹄啮长鸣，如索水草。图龙于素，舒卷辄云气萦集。世祖重之，使居禁中，天下号为“画圣”，非有诏不得与外人画。时有王子冲，善棋通神，号为“二绝”。见《北齐史》。
lit_da371ebb,张下,《历代名画记》,卷八 北齐,阎立本,,阎立本云：“自像人以来，曲尽其妙，简易标美，多不可减，少不可逾，其唯子华乎！”僧悰云：“在孙下、田上。”李云：“在上品。张下，郑上。”《斛律金像》《北齐贵戚游苑图》《宫苑人物》（屏风）、《邺中百戏狮猛图》并传于代。
lit_818660d6,刘杀鬼,《历代名画记》,卷八 北齐,张彦远,下品,刘杀鬼，下品。与杨子华同时，世祖俱重之。画斗雀于壁间，帝见之为生，拂之方觉。常在禁中，锡赉巨万。任梁州刺史。见《北齐书·词苑传》。
lit_1cdec0d0,杨子华,《历代名画记》,卷八 北齐,张彦远,,刘杀鬼，下品。与杨子华同时，世祖俱重之。画斗雀于壁间，帝见之为生，拂之方觉。常在禁中，锡赉巨万。任梁州刺史。见《北齐书·词苑传》。
lit_532f21ff,曹仲达,《历代名画记》,卷八 北齐,僧悰,,曹仲达，本曹国人也。北齐最称工，能画梵像，官至朝散大夫。国朝宣律师撰《三宝感通记》，具载仲达画佛之妙，颇有灵感。僧悰云：“曹师于袁，冰寒于水。外国佛像，亡竞于时。”《卢思道斛律明月慕容绍宗等像》《弋猎图》《齐武临轩对武骑》《名马图》传于代。
lit_98897fb6,殷英童,《历代名画记》,卷八 北齐,张彦远,,殷英童，善画，兼楷、隶。
lit_023230ec,殷英童,《历代名画记》,卷八 北齐,张彦远,,殷英童，擅长绘画，也善于作楷书、隶书。
lit_62daa11d,冯提伽,《历代名画记》,卷八 后周,窦蒙,,冯提伽，北平人也。官至散骑常侍，兼礼部侍郎。志尚清远，后避周末之乱，佣画于并、汾之间。窦蒙云：“寺壁皆有合作，风格精密，动若神契。”彦远按：提伽之迹，未甚精密，山川草树，宛然塞北。车马为得意，人物非所长。
lit_a2df5ace,阎毗,《历代名画记》,卷八 隋,张彦远,,阎毗，榆林盛乐人。工篆、隶，善丹青，当时号为“臻绝”。周武帝时，拜仪同三司。隋帝爱其才艺，令侍东宫，数以雕丽之物，取悦于皇太子。拜车骑将军。隋炀帝令毗修辇辂，多所损益，与宇文恺参详故实，并推巧思。官至朝散大夫、将作少监。见《隋书》。时有何稠，字桂林，刘龙，龙弟衮，并有巧思，绝世过人。
lit_ef99d6df,展子虔,《历代名画记》,卷八 隋,僧悰,中品下,展子虔，中品下。历北齐、周、隋，在隋为朝散大夫、帐内都督。僧悰云：“触物留情，备皆妙绝。尤善台阁、人马，山川咫尺千里。”李云：“董、展同品。董有展之车马，展亡董之台阁。”《法华变》（白麻纸）、《长安车马人物图》《弋猎图》《杂宫苑》《南郊》（白画）、《王世充像》《北齐后主幸晋阳图》《朱买臣覆水图》并传于代。
lit_091fc67f,郑法士,《历代名画记》,卷八 隋,张彦远,中品上,郑法士，中品上。在周为大都督、左员外侍郎、建中将军，封长社县子。入隋，授中散大夫。
lit_52090b32,孙尚子,《历代名画记》,卷八 隋,僧悰,,僧悰云：“取法张公，备该万物。后来冠冕，获擅名家。”在孙尚子上。
lit_4004261f,孙尚子,《历代名画记》,卷八 隋,僧悰,上品中,孙尚子，上品中。睦州建德县尉。僧悰云：“师模顾、陆，骨气有余。鬼神特所偏善，妇人亦有风态。”在法士下，子华上。
lit_77233769,董伯仁,《历代名画记》,卷八 隋,张彦远,中品上,董伯仁，中品上。汝南人也。多才艺，乡里号为“智海”。官至光禄大夫，殿中将军。
lit_95d0c330,董伯仁,《历代名画记》,卷八 隋,张彦远,中品上,董伯仁，中品上。汝南人。有多项才能与技艺，乡里人称他为“智海”。官至光禄大夫、殿中将军。
lit_71f3a8a9,杨契丹,《历代名画记》,卷八 隋,张彦远,上品中,杨契丹。上品中。官至上仪同。
lit_a9cba01c,杨契丹,《历代名画记》,卷八 隋,张彦远,上品中,杨契丹，上品中。官至上仪同大将军。
lit_03fd9ebe,刘乌,《历代名画记》,卷八 隋,僧悰,下品,刘乌。下品。僧悰云：“师于郑，屏障有功。其于绵密，独越伦辈。”李云：“学于郑，不少风格，但未遒耳。”
lit_07248a82,江志,《历代名画记》,卷八 隋,僧悰,中品,江志。中品。僧悰云：“笔力劲健，风韵顿挫，模山拟石，妙得其真。”
lit_ef413ab5,王仲舒,《历代名画记》,卷八 隋,僧悰,下品,王仲舒。下品。僧悰云：“北面孙公，风骨不逮。精熟润媚，推于名辈。”
lit_798775ef,阎思光,《历代名画记》,卷八 隋,张彦远,下品,阎思光、下品。解悰、下品。程瓒，下品。已上三人，并隋朝名手。
lit_1e54b52e,解悰,《历代名画记》,卷八 隋,张彦远,,阎思光、下品。解悰、下品。程瓒，下品。已上三人，并隋朝名手。
lit_e4c0cd39,程瓒,《历代名画记》,卷八 隋,张彦远,,阎思光、下品。解悰、下品。程瓒，下品。已上三人，并隋朝名手。
lit_279af433,滕王元婴,《历代名画记》,卷九 唐朝上,张彦远,,滕王元婴，亦善画。
lit_e9319dc9,阎立德,《历代名画记》,卷九 唐朝上,张彦远,上品下,阎立德，上品下。阎让，字立德，以字行于代。父毗，在隋以丹青知名，已在第八卷中具载。与弟立本，俱传家业。武德中，为尚衣奉御，造衮冕大裘等六服，腰舆、伞扇，咸得妙制。贞观初，为将作大匠，造翠微、玉华宫，称旨。官至工部尚书，封大安县公。显庆元年赠吏部尚书、并州都督，谥曰康。《文成公主降番图》《玉华宫图》《斗鸡图》并传于代。
lit_4213c236,张孝师,《历代名画记》,卷九 唐朝上,张彦远,下品,张孝师，下品。为骠骑尉。尤善画地狱，气候幽默。孝师曾死复苏，具见冥中事，故备得之。吴道玄见其画，因号为“地狱变”。窦云：“迹简而粗，物情皆备。除谢、顾、陆、张、杨、田、董、展外，难可比俦也。”
lit_a908399b,尉迟乙僧,《历代名画记》,卷九 唐朝上,僧悰,,尉迟乙僧，于阗国人，父跋质那。具第八卷。乙僧国初授宿卫官，袭封郡公，善画外国及佛像。时人以跋质那为“大尉迟”，乙僧为“小尉迟”。画外国及菩萨，小则用笔紧劲，如屈铁盘丝，大则洒落有气概。僧悰云：“外国、鬼神，奇形异貌，中华罕继。”窦云：“澄思用笔，虽与中华道殊，然气正迹高，可与顾、陆为友。”
lit_5f424905,刘孝师,《历代名画记》,卷九 唐朝上,僧悰,,刘孝师。僧悰云：“点画不多，皆为枢要。鸟雀奇变，甚为酷似。”彦远云：“不止鸟雀，曾见画他物，皆好。”
lit_1a24b902,靳智异,《历代名画记》,卷九 唐朝上,僧悰,,靳智异。僧悰云：“祖述仲达，改张琴瑟。变夷为夏，肇自斯人。”在范长寿上。
lit_66375de0,王定,《历代名画记》,卷九 唐朝上,僧悰,,王定，官至中散大夫、尚方令。贞观初得名，笔迹甚快。《本草训戒图》传于代。僧悰云：“骨气不足，遒媚有余。菩萨圣僧，往往惊绝。”在张孝师上。彦远按：定画，骨气不甚长，既亡骨气，何故惊绝？
lit_d1da83ec,张孝师,《历代名画记》,卷九 唐朝上,僧悰,,王定，官至中散大夫、尚方令。贞观初得名，笔迹甚快。《本草训戒图》传于代。僧悰云：“骨气不足，遒媚有余。菩萨圣僧，往往惊绝。”在张孝师上。彦远按：定画，骨气不甚长，既亡骨气，何故惊绝？
lit_56f05df4,吴智敏,《历代名画记》,卷九 唐朝上,僧悰,,梁宽、吴智敏。僧悰云：“智敏师于宽，神襟更为俊逸。”
lit_ff14d46a,梁宽,《历代名画记》,卷九 唐朝上,僧悰,,梁宽、吴智敏。僧悰云：“智敏师于宽，神襟更为俊逸。”
lit_9ee59483,康萨陀,《历代名画记》,卷九 唐朝上,僧悰,中品,康萨陀，中品，或云“善陀”。为振威校尉。僧悰云：“亡所服膺，虚心自悟。初花晚叶，变态多端；异兽奇禽，千形万状。”在尉迟下。窦云：“曾见画人、马，措意非高，悰公之评过当也。”
lit_22be9e6d,张孝师,《历代名画记》,卷九 唐朝上,僧悰,,王知慎，中品下。终少府监。工书画，与兄知敬齐名。僧悰云：“师于阎，写貌及之，笔力爽利，风采不凡。”在张孝师下。
lit_5596a35b,师于阎,《历代名画记》,卷九 唐朝上,僧悰,,王知慎，中品下。终少府监。工书画，与兄知敬齐名。僧悰云：“师于阎，写貌及之，笔力爽利，风采不凡。”在张孝师下。
lit_94b34111,王知慎,《历代名画记》,卷九 唐朝上,僧悰,中品下,王知慎，中品下。终少府监。工书画，与兄知敬齐名。僧悰云：“师于阎，写貌及之，笔力爽利，风采不凡。”在张孝师下。
lit_d469ba1e,王韶应,《历代名画记》,卷九 唐朝上,张彦远,,王韶应，或作“韶隐”。画鬼神，深有气韵。窦云：“善山水、人马。”
lit_12e2dc59,檀智敏,《历代名画记》,卷九 唐朝上,”僧悰,中品,檀智敏，中品。为振武校尉。窦云：“师于董伯仁。”僧悰云：“栋宇楼台，阴阳向背，历观前古，独见斯人。”《游春戏艺图》传于世。
lit_cd3ae314,董伯仁,《历代名画记》,卷九 唐朝上,”僧悰,,檀智敏，中品。为振武校尉。窦云：“师于董伯仁。”僧悰云：“栋宇楼台，阴阳向背，历观前古，独见斯人。”《游春戏艺图》传于世。
lit_0ca7a259,范龙树,《历代名画记》,卷九 唐朝上,张彦远,,杨须跋、中品。赵武端、下品。范龙树、下品。周乌孙、下品。杨德绍，下品。已上五人，国初擅名。
lit_0745e0fe,杨德绍,《历代名画记》,卷九 唐朝上,张彦远,,杨须跋、中品。赵武端、下品。范龙树、下品。周乌孙、下品。杨德绍，下品。已上五人，国初擅名。
lit_ca5d2a2e,周乌孙,《历代名画记》,卷九 唐朝上,张彦远,,杨须跋、中品。赵武端、下品。范龙树、下品。周乌孙、下品。杨德绍，下品。已上五人，国初擅名。
lit_5f3ae120,杨须跋,《历代名画记》,卷九 唐朝上,张彦远,中品,杨须跋、中品。赵武端、下品。范龙树、下品。周乌孙、下品。杨德绍，下品。已上五人，国初擅名。
lit_d26ed770,赵武端,《历代名画记》,卷九 唐朝上,张彦远,,杨须跋、中品。赵武端、下品。范龙树、下品。周乌孙、下品。杨德绍，下品。已上五人，国初擅名。
lit_c4ce74fc,陈义,《历代名画记》,卷九 唐朝上,张彦远,,陈义，国初丞相叔达之玄孙，尤工写貌。玄宗少与之善，特承恩遇，为武德、南薰、中尚等使，银青光禄大夫、少府监。
lit_dc8321b2,钱国养,《历代名画记》,卷九 唐朝上,”彦远,,钱国养，开元中，善写貌，海内推服。窦云：“衣裳凡鄙，未离贱工，格律自高，足为出众。”彦远云：“既言凡鄙贱工，安得格律出众？窦君两句之评，自相矛盾。”
lit_dd45dd7b,左文通,《历代名画记》,卷九 唐朝上,张彦远,,左文通，善写貌。
lit_bffbfb94,左文通,《历代名画记》,卷九 唐朝上,张彦远,,左文通，擅长画人物肖像。
lit_2e487888,李生,《历代名画记》,卷九 唐朝上,张彦远,,李生，失名，亦吴弟子。善画地狱佛像，有类于吴而稍劣。
lit_1977bd15,张藏,《历代名画记》,卷九 唐朝上,张彦远,,张藏，亦吴弟子也。裁度粗快，思若涌泉，寺壁十间，不旬而毕。然“六法”不及师之门墙。亦好细画。
lit_1f293fd1,杨庭光,《历代名画记》,卷九 唐朝上,张彦远,,杨庭光，与吴同时。佛像经变、杂画、山水极妙。颇有似吴生处，但下笔稍细耳。
lit_688bce56,武静藏,《历代名画记》,卷九 唐朝上,张彦远,,武静藏，善画鬼神，有气韵。东都敬爱寺东山亭院，地狱变画，甚妙。
lit_d2b98638,董崿,《历代名画记》,卷九 唐朝上,张彦远,,董崿，字重照，开元中多在尚方。善杂画，车牛最推其妙。《盘车图》余亦曾模之。
lit_9e7e12dd,陈静心,《历代名画记》,卷九 唐朝上,张彦远,,陈静心，善寺壁。弟静眼，善地狱、山水。
lit_3bffd1c1,程雅,《历代名画记》,卷九 唐朝上,张彦远,,程雅，善杂画。
lit_7a6616d9,程雅,《历代名画记》,卷九 唐朝上,张彦远,,程雅，善于画杂画。
lit_24867d2e,杨仙乔,《历代名画记》,卷九 唐朝上,张彦远,,杨坦、杨仙乔，并长安人，好图佛寺、鬼神。坦子爽，亦善之。
lit_92a42e8e,杨坦,《历代名画记》,卷九 唐朝上,张彦远,,杨坦、杨仙乔，并长安人，好图佛寺、鬼神。坦子爽，亦善之。
lit_3e623913,解倩,《历代名画记》,卷九 唐朝上,张彦远,,解倩，善鬼神。
lit_c103fa5f,解倩,《历代名画记》,卷九 唐朝上,张彦远,,解倩，善画鬼神。
lit_d3d3fbe4,冯绍正,《历代名画记》,卷九 唐朝上,张彦远,,冯绍正，开元中，任少府监，八年，为户部侍郎。尤善鹰鹘鸡雉，尽其形态，觜眼脚爪，毛彩俱妙。曾于禁中画五龙堂，亦称其善，有降云蓄雨之感。
lit_51310d34,姜皎,《历代名画记》,卷九 唐朝上,张彦远,,姜皎，上邽人。善鹰鸟。玄宗在藩时，为尚衣奉御，有先识之明。玄宗即位，累官至太常卿，封楚国公。开元五年，以事废，复拜银青光禄大夫、秘书监。十年，复流钦州。
lit_36b3fa1f,姜皎,《历代名画记》,卷九 唐朝上,张彦远,,姜皎，上邽人。善画鹰。唐玄宗在藩国时，姜皎任职尚衣奉御，他有先见之明。唐玄宗即位后，姜皎不断升迁，官至太常卿，被封为楚国公。开元五年因事被废，后又授银青光禄大夫、秘书监。开元十年，被流放到钦州。
lit_97f2107c,李思训,《历代名画记》,卷九 唐朝上,张彦远,,李思训，宗室也，即林甫之伯父。早以艺称于当时，一家五人，并善丹青。思训弟思诲，思诲子林甫，林甫弟昭道，林甫侄凑。世咸重之，书画称一时之妙。官至左武卫大将军，封彭城公，开元六年赠秦州都督。其画山水、树石，笔格遒劲，湍濑潺湲，云霞缥缈，时睹神仙之事，窅然岩岭之幽。时人谓之“大李将军”其人也。
lit_8d051bb1,李林甫,《历代名画记》,卷九 唐朝上,与林甫诗,,李林甫，亦善丹青。高詹事与林甫诗曰：“兴中唯白云，身外即丹青。”余曾见其画迹甚佳，山水小类李中舍也。
lit_c2d1f4ea,李凑,《历代名画记》,卷九 唐朝上,张彦远,,李凑，林甫之侄也。初为广陵仓曹，天宝中贬明州象山县尉，年二十八。尤工绮罗人物，为时惊绝。本师阎令，但笔迹疏散，言其媚态，则尽美矣。
lit_9828133e,薛稷,《历代名画记》,卷九 唐朝上,张彦远,,薛稷，字嗣通，河东汾阴人。道衡之曾孙，元超之从子。词学名家，轩冕继代。景龙末为谏议大夫、昭文馆学士，多才藻，工书画。薛稷外祖魏文贞公富有书画，多虞、褚手写表疏。稷锐意模学，穷年忘倦。睿宗在藩，特见引遇，拜黄门、中书侍郎，礼、工二部尚书。先天二年，官至银青光禄大夫、太子少保，封晋国公。窦怀贞累之，年六十九。尤善花鸟、人物、杂画，画鹤知名，屏风六扇鹤样，自稷始也。
lit_f04886c4,师于阎,《历代名画记》,卷九 唐朝上,张彦远,,曹元廓，天后朝为朝散大夫、左尚方令。师于阎，工骑猎、人马、山水，善于布置。天后铸九鼎于东都，备九州山川物产，诏命元廓画样，锺绍京书，时称绝妙。后周、北齐、梁、陈、隋、武德、贞观、永徽等朝臣图，高祖、太宗诸子图，《秦府学士图》《凌烟图》，皆传于代，徐峤之题。
lit_edeb98c9,曹元廓,《历代名画记》,卷九 唐朝上,张彦远,,曹元廓，天后朝为朝散大夫、左尚方令。师于阎，工骑猎、人马、山水，善于布置。天后铸九鼎于东都，备九州山川物产，诏命元廓画样，锺绍京书，时称绝妙。后周、北齐、梁、陈、隋、武德、贞观、永徽等朝臣图，高祖、太宗诸子图，《秦府学士图》《凌烟图》，皆传于代，徐峤之题。
lit_164f3888,刘行臣,《历代名画记》,卷九 唐朝上,张彦远,,刘行臣，善画鬼神，精采洒落，类王韶应。东都敬爱寺山亭院西壁，有鬼神抱野鸡，实为妙手。
lit_7dd7ea47,王韶应,《历代名画记》,卷九 唐朝上,张彦远,,刘行臣，善画鬼神，精采洒落，类王韶应。东都敬爱寺山亭院西壁，有鬼神抱野鸡，实为妙手。
lit_ca805185,杨昇,《历代名画记》,卷九 唐朝上,张彦远,,杨宁、杨昇、《望贤宫图》《安禄山真》。张萱，已上三人并善画人物。宁以开元十一年为史馆画直，萱好画妇女、婴儿。有《妓女图》《乳母将婴儿图》《按羯鼓图》《秋千图》《虢国夫人出游图》传于代。
lit_e37aa9e2,杨宁,《历代名画记》,卷九 唐朝上,张彦远,,杨宁、杨昇、《望贤宫图》《安禄山真》。张萱，已上三人并善画人物。宁以开元十一年为史馆画直，萱好画妇女、婴儿。有《妓女图》《乳母将婴儿图》《按羯鼓图》《秋千图》《虢国夫人出游图》传于代。
lit_e587f8e5,张萱,《历代名画记》,卷九 唐朝上,张彦远,,杨宁、杨昇、《望贤宫图》《安禄山真》。张萱，已上三人并善画人物。宁以开元十一年为史馆画直，萱好画妇女、婴儿。有《妓女图》《乳母将婴儿图》《按羯鼓图》《秋千图》《虢国夫人出游图》传于代。
lit_5b3166f1,杨昇,《历代名画记》,卷九 唐朝上,张彦远,,杨宁、杨昇、绘有《望贤宫图》《安禄山真》。张萱，以上三人都擅画人物。杨宁在开元十一年时任史馆画直，张萱喜好画妇人、婴孩。有作品《妓女图》《乳母将婴儿图》《按羯鼓图》《秋千图》《虢国夫人出游图》流传于世。
lit_52bd0e77,杨宁,《历代名画记》,卷九 唐朝上,张彦远,,杨宁、杨昇、绘有《望贤宫图》《安禄山真》。张萱，以上三人都擅画人物。杨宁在开元十一年时任史馆画直，张萱喜好画妇人、婴孩。有作品《妓女图》《乳母将婴儿图》《按羯鼓图》《秋千图》《虢国夫人出游图》流传于世。
lit_0d30922d,张萱,《历代名画记》,卷九 唐朝上,张彦远,,杨宁、杨昇、绘有《望贤宫图》《安禄山真》。张萱，以上三人都擅画人物。杨宁在开元十一年时任史馆画直，张萱喜好画妇人、婴孩。有作品《妓女图》《乳母将婴儿图》《按羯鼓图》《秋千图》《虢国夫人出游图》流传于世。
lit_c89774c3,尹琳,《历代名画记》,卷九 唐朝上,张彦远,,尹琳，善佛事、神鬼、寺壁。高宗时得名，笔迹快利。今京师慈恩寺塔下南面师利、普贤，极妙。李仲昌、李嗣真并琳弟子，并善佛道鬼神。
lit_6d2482c6,李嗣真,《历代名画记》,卷九 唐朝上,张彦远,,尹琳，善佛事、神鬼、寺壁。高宗时得名，笔迹快利。今京师慈恩寺塔下南面师利、普贤，极妙。李仲昌、李嗣真并琳弟子，并善佛道鬼神。
lit_983e263b,李仲昌,《历代名画记》,卷九 唐朝上,张彦远,,尹琳，善佛事、神鬼、寺壁。高宗时得名，笔迹快利。今京师慈恩寺塔下南面师利、普贤，极妙。李仲昌、李嗣真并琳弟子，并善佛道鬼神。
lit_70abc202,韦无忝,《历代名画记》,卷九 唐朝上,张彦远,,韦无忝，官至左武卫将军，善鞍马、鹘、象、鹰图，杂兽皆妙。
lit_8ee1522a,韦无忝,《历代名画记》,卷九 唐朝上,张彦远,,韦无忝，官至左武卫将军，擅长画鞍马、鹘、象、鹰等图，其他野兽也画得十分精妙。
lit_e6875527,韦无踪,《历代名画记》,卷九 唐朝上,张彦远,,韦无踪，乃无忝弟，善写貌。
lit_9280c918,朱抱一,《历代名画记》,卷九 唐朝上,张彦远,,朱抱一，开元二十二年，直集贤。善写貌，写张果先生真，为好事所传。
lit_1f80756a,任贞亮,《历代名画记》,卷九 唐朝上,张彦远,,任贞亮，开元中，直集贤。时有画直邵斋钦，书手吉旷，皆解画。
lit_bc06a363,任贞亮,《历代名画记》,卷九 唐朝上,张彦远,,任贞亮，开元年间在集贤院任直学士。当时，还有画直邵斋钦，书手吉旷，这三人都懂得绘画。
lit_7ab54352,陆庭曜,《历代名画记》,卷九 唐朝上,张彦远,,陆庭曜，善人物、鬼神，有气韵。
lit_ed0506bf,陆庭曜,《历代名画记》,卷九 唐朝上,张彦远,,陆庭曜，善于画人物、鬼神，绘画富有气韵。
lit_5e00a079,殷令名,《历代名画记》,卷九 唐朝上,张彦远,,殷令名，陈郡人。父不害，累代工书画。
lit_04c9acba,殷令名,《历代名画记》,卷九 唐朝上,张彦远,,殷令名，陈郡人。父亲殷不害，家族世代都擅长书画。
lit_96a1f220,殷闻礼,《历代名画记》,卷九 唐朝上,张彦远,,殷闻礼，字大端，书画妙过于父。武德初，为中书舍人，赵王友兼侍读、弘文馆学士。
lit_8efdafe5,武德初,《历代名画记》,卷九 唐朝上,张彦远,,殷闻礼，字大端，书画妙过于父。武德初，为中书舍人，赵王友兼侍读、弘文馆学士。
lit_cf4dd2dd,李凑,《历代名画记》,卷九 唐朝上,张彦远,,谈皎，善画人物，有态度，衣裳润媚，但格律不高。大髻宽衣，亦当时所尚。与李凑小相类。《武惠妃舞图》《佳丽寒食图》《佳丽伎乐图》并传于代。
lit_ac9af9e6,谈皎,《历代名画记》,卷九 唐朝上,张彦远,,谈皎，善画人物，有态度，衣裳润媚，但格律不高。大髻宽衣，亦当时所尚。与李凑小相类。《武惠妃舞图》《佳丽寒食图》《佳丽伎乐图》并传于代。
lit_6e3cac90,张遵礼,《历代名画记》,卷九 唐朝上,张彦远,,张遵礼，善画斗将、鞍马、戈矛、器械，用笔堑差。小画尤佳。
lit_c2b18a5f,王绍宗,《历代名画记》,卷九 唐朝上,张彦远,,王绍宗，琅琊人。父修礼，画迹与殷仲容相类。亦善书，官至秘书少监。
lit_792d46b8,宋令文,《历代名画记》,卷九 唐朝上,张彦远,,宋令文，亦书画皆善。
lit_4a08ba98,卢鸿,《历代名画记》,卷九 唐朝上,张彦远,,卢鸿，一名浩然，高士也。工八分书，善画山水树石，隐于嵩山。开元初，征拜谏议大夫，不受。
lit_e53a0228,郑虔,《历代名画记》,卷九 唐朝上,张彦远,,郑虔，高士也。苏许公为宰相，申以忘年之契，荐为著作郎。开元二十五年，为广文馆学士，饥穷轗轲，好琴、酒、篇咏，工山水。进献诗篇及书画，玄宗御笔题曰“郑虔三绝”。与杜甫、李白为诗酒友。禄山授以伪水部员外郎，国家收复，贬台州司户。
lit_39c5ca39,郑逾,《历代名画记》,卷九 唐朝上,张彦远,,郑逾，善山水。天宝中得名于梁宋间。逾即郑迁之弟。迁有书名。
lit_b526de09,李果奴,《历代名画记》,卷九 唐朝上,张彦远,,李果奴，笔迹调润。天宝中，写貌人物及僧佛为妙。元和中有李士昉，即果奴之孙，笔迹及其祖，写貌极妙。在翰林、集贤。
lit_aff10cf7,曹霸,《历代名画记》,卷九 唐朝上,张彦远,,曹霸，魏曹髦之后。髦画称于后代。霸在开元中已得名。天宝末，每诏写御马及功臣，官至左武卫将军。
lit_6215d826,韩幹,《历代名画记》,卷九 唐朝上,张彦远,,韩幹，大梁人。王右丞维见其画，遂推奖之，官至太府寺丞，善写貌人物。《龙朔功臣图》《姚崇及安禄山图》《玄宗试马图》《宁王调马打球图》并传于代。
