lit_id,target_ref,source_book,source_chapter,author_ref,quality_rank,source_text
lit_b6b9f5ac,曹霸,《历代名画记》,卷九 唐朝上,画马歌》,,尤工鞍马。初师曹霸，后自独擅。杜甫《曹霸画马歌》曰：“弟子韩幹早入室，亦能画马穷殊相。幹惟画肉不画骨，忍使骅骝气凋丧。”彦远以杜甫岂知画者，徒以幹马肥大，遂有画肉之诮。古人画马有《八骏图》，或云史道硕之迹，或云史秉之迹。皆螭颈龙体，矢激电驰，非马之状也。晋、宋间顾、陆之辈，已称改步；周、齐间董、展之流，亦云变态。虽权奇灭没，乃屈产、蜀驹，尚翘举之姿，乏安徐之体，至于毛色，多䯄骝骓驳，无他奇异。
lit_8e5af059,史道硕,《历代名画记》,卷九 唐朝上,画马歌》,,尤工鞍马。初师曹霸，后自独擅。杜甫《曹霸画马歌》曰：“弟子韩幹早入室，亦能画马穷殊相。幹惟画肉不画骨，忍使骅骝气凋丧。”彦远以杜甫岂知画者，徒以幹马肥大，遂有画肉之诮。古人画马有《八骏图》，或云史道硕之迹，或云史秉之迹。皆螭颈龙体，矢激电驰，非马之状也。晋、宋间顾、陆之辈，已称改步；周、齐间董、展之流，亦云变态。虽权奇灭没，乃屈产、蜀驹，尚翘举之姿，乏安徐之体，至于毛色，多䯄骝骓驳，无他奇异。
lit_70019cbb,韩幹,《历代名画记》,卷九 唐朝上,画马歌》,,尤工鞍马。初师曹霸，后自独擅。杜甫《曹霸画马歌》曰：“弟子韩幹早入室，亦能画马穷殊相。幹惟画肉不画骨，忍使骅骝气凋丧。”彦远以杜甫岂知画者，徒以幹马肥大，遂有画肉之诮。古人画马有《八骏图》，或云史道硕之迹，或云史秉之迹。皆螭颈龙体，矢激电驰，非马之状也。晋、宋间顾、陆之辈，已称改步；周、齐间董、展之流，亦云变态。虽权奇灭没，乃屈产、蜀驹，尚翘举之姿，乏安徐之体，至于毛色，多䯄骝骓驳，无他奇异。
lit_faa9c118,陈闳,《历代名画记》,卷九 唐朝上,张彦远,,陈闳，为永王府长史，善画写貌，工鞍马。与韩同时，家蓄图画绝多。写《安禄山图》《玄宗马射图》《上党十九瑞图》。
lit_10dbfe0f,孟仲晖,《历代名画记》,卷九 唐朝上,张彦远,,孟仲晖，善写貌，笔迹类陈闳，又似阎令。时有杜景祥、王允之，并画迹与仲晖相近也。
lit_12540943,陈闳,《历代名画记》,卷九 唐朝上,张彦远,,孟仲晖，善写貌，笔迹类陈闳，又似阎令。时有杜景祥、王允之，并画迹与仲晖相近也。
lit_385bff1d,张諲,《历代名画记》,卷十 唐朝下,王维答诗,,张諲，官至刑部员外郎，明《易》象，善草隶，工丹青。与王维、李颀等为诗酒丹青之友。尤善画山水。王维答诗曰：“屏风误点惑孙郎，团扇草书轻内史。”李颀诗曰：“小王破体闲文策，落日梨花照空壁。书堪记室妒风流，画与将军作勍敌。”“画”，一作“书”。
lit_aea4c6c8,王维,《历代名画记》,卷十 唐朝下,王维答诗,,张諲，官至刑部员外郎，明《易》象，善草隶，工丹青。与王维、李颀等为诗酒丹青之友。尤善画山水。王维答诗曰：“屏风误点惑孙郎，团扇草书轻内史。”李颀诗曰：“小王破体闲文策，落日梨花照空壁。书堪记室妒风流，画与将军作勍敌。”“画”，一作“书”。
lit_fbdd587f,刘方平,《历代名画记》,卷十 唐朝下,张彦远,,刘方平，工山水、树石，汧国公李勉甚重之。
lit_e6f69b67,刘方平,《历代名画记》,卷十 唐朝下,张彦远,,刘方平，擅长画山水、树石，汧国公李勉十分器重他。
lit_e94f5bf4,王熊,《历代名画记》,卷十 唐朝下,张彦远,,王熊，官至潭州都督，尝与张燕公唱和诗句。善湘中山水，似李将军。意绪不卑，但笔迹轻细。
lit_200398bb,田琦,《历代名画记》,卷十 唐朝下,张彦远,,田琦，雁门人。武德功臣、兵部尚书德平之子。善写貌人物，官至汝南太守。尤善八分、小篆，写《洪崖子橘术图》传于代。
lit_48a36f8b,窦师纶,《历代名画记》,卷十 唐朝下,张彦远,,窦师纶，字希言，纳言、陈国公抗之子。初为太宗秦王府谘议、相国录事参军，封陵阳公。性巧绝，草创之际，乘舆皆阙，敕兼益州大行台、检校修造。凡创瑞锦宫绫，章彩奇丽，蜀人至今谓之“陵阳公样”。官至太府卿，银、坊、邛三州刺史。高祖、太宗时，内库瑞锦，对雉、斗羊、翔凤、游麟之状，创自师纶，至今传之。
lit_1dae5b74,江都王绪,《历代名画记》,卷十 唐朝下,张彦远,,江都王绪，霍王元轨之子，太宗皇帝犹子也。多才艺，善书画，鞍马擅名。垂拱中，官至金州刺史。
lit_f0acc1d0,李平钧,《历代名画记》,卷十 唐朝下,张彦远,,李平钧，宗室也。淮安王神通之曾孙，为江陵府法曹参军、汴州陈留令。平钧工山水、小篆。平钧之叔李权，工八分。叔枢，工小篆。
lit_c5517c15,张通,《历代名画记》,卷十 唐朝下,张彦远,,崔阳元、李炅、张维亘、李滔、张通、耿昌言、弟昌期，已上七人，并工山水、杂画，通尤精瞻。
lit_c849574a,耿昌言,《历代名画记》,卷十 唐朝下,张彦远,,崔阳元、李炅、张维亘、李滔、张通、耿昌言、弟昌期，已上七人，并工山水、杂画，通尤精瞻。
lit_b93ae4c5,李炅,《历代名画记》,卷十 唐朝下,张彦远,,崔阳元、李炅、张维亘、李滔、张通、耿昌言、弟昌期，已上七人，并工山水、杂画，通尤精瞻。
lit_c2b53956,崔阳元,《历代名画记》,卷十 唐朝下,张彦远,,崔阳元、李炅、张维亘、李滔、张通、耿昌言、弟昌期，已上七人，并工山水、杂画，通尤精瞻。
lit_e8bbc829,李滔,《历代名画记》,卷十 唐朝下,张彦远,,崔阳元、李炅、张维亘、李滔、张通、耿昌言、弟昌期，已上七人，并工山水、杂画，通尤精瞻。
lit_08f6b3c4,张维亘,《历代名画记》,卷十 唐朝下,张彦远,,崔阳元、李炅、张维亘、李滔、张通、耿昌言、弟昌期，已上七人，并工山水、杂画，通尤精瞻。
lit_0bf3bad0,周古言,《历代名画记》,卷十 唐朝下,张彦远,,周古言，中宗时，善写貌及妇女。有《宫禁寒食图》《秋思图》传于代。
lit_32f21a07,李韶,《历代名画记》,卷十 唐朝下,张彦远,,贝俊、一作“具俊”。李韶、魏晋孙、蒯廉，已上四人，并工花鸟。俊尤工鹰、鹘，蒯廉最为妙。
lit_81f987ee,贝俊,《历代名画记》,卷十 唐朝下,张彦远,,贝俊、一作“具俊”。李韶、魏晋孙、蒯廉，已上四人，并工花鸟。俊尤工鹰、鹘，蒯廉最为妙。
lit_3c939289,蒯廉,《历代名画记》,卷十 唐朝下,张彦远,,贝俊、一作“具俊”。李韶、魏晋孙、蒯廉，已上四人，并工花鸟。俊尤工鹰、鹘，蒯廉最为妙。
lit_4ac2cd66,魏晋孙,《历代名画记》,卷十 唐朝下,张彦远,,贝俊、一作“具俊”。李韶、魏晋孙、蒯廉，已上四人，并工花鸟。俊尤工鹰、鹘，蒯廉最为妙。
lit_79902141,白旻,《历代名画记》,卷十 唐朝下,张彦远,,白旻，官至同州澄城令。工花鸟、鹰鹘，觜爪纤利，甚得其趣。旻善歌，常醉酣歌阕，便画自娱。
lit_7d1034aa,韩嶷,《历代名画记》,卷十 唐朝下,张彦远,,韩嶷，工妇女、杂画，善布色。
lit_8b713667,高江,《历代名画记》,卷十 唐朝下,张彦远,,高江、车道政，二人并善写貌。道政兼善佛事，迹简而笔健。
lit_add76e95,车道政,《历代名画记》,卷十 唐朝下,张彦远,,高江、车道政，二人并善写貌。道政兼善佛事，迹简而笔健。
lit_75df9883,高江,《历代名画记》,卷十 唐朝下,张彦远,,高江、车道政，二人都善画人物肖像。车道政同时还擅长佛像画，笔法简练而刚健有力。
lit_823f66df,车道政,《历代名画记》,卷十 唐朝下,张彦远,,高江、车道政，二人都善画人物肖像。车道政同时还擅长佛像画，笔法简练而刚健有力。
lit_1bd29577,朱审,《历代名画记》,卷十 唐朝下,张彦远,,朱审，吴兴人。工画山水，深沉瑰壮，险黑磊落，湍濑激人，平远极目。建中年颇知名。
lit_83d866af,王宰,《历代名画记》,卷十 唐朝下,张彦远,,王宰，蜀中人。多画蜀山，玲珑窳窆，巉嵯巧峭。
lit_62a3f9e7,王宰,《历代名画记》,卷十 唐朝下,张彦远,,王宰，蜀中人。多画蜀中山岳，所画山玲珑有势，岩高低不平，意趣横生。
lit_885ff835,杨公南,《历代名画记》,卷十 唐朝下,张彦远,,杨公南，名炎，华阴人。孝著三代，门树六阙。风骨俊秀，神情爽迈。善山水，高奇雅赡。大历四年为中书门下侍郎，建中元年迁左仆射，流贬，年五十五。余观杨公山水图，想见其为人魁岸洒落也。
lit_f4416ec6,史瓒,《历代名画记》,卷十 唐朝下,张彦远,,史瓒，官至省郎，善画鞍马、人物。
lit_8033e856,裴谞,《历代名画记》,卷十 唐朝下,张彦远,,裴谞，字士明，河东人。以明经进，画山水极有思。贞元中为吏部侍郎兼御史大夫，四年为太子宾客、左散骑常侍，五年为兵部侍郎、河南尹。贞元九年，年七十五，赠兵部尚书。
lit_e1c548de,裴谞,《历代名画记》,卷十 唐朝下,张彦远,,裴谞，字士明，河东人。以明经科考取进士，所画山水构思极巧妙。贞元年间，担任吏部侍郎兼御史大夫，贞元四年为太子宾客、左散骑常侍，贞元五年为兵部侍郎、河南府尹。贞元九年去世，享年七十五岁，追赠兵部尚书。
lit_66e973d1,韦鉴,《历代名画记》,卷十 唐朝下,张彦远,,韦鉴，工龙马，妙得精气。
lit_626c8bc4,陈昙,《历代名画记》,卷十 唐朝下,张彦远,,陈昙，字玄成，国初丞相叔达之后。明经出身，河南尹严武荐为参军，昭义军节度使李抱真辟为从事。贞元十四年，官至衡州刺史、邕管经略使兼御史中丞。工山水，有情趣，但峰峦少奇，往往繁碎。
lit_3cbe7c9a,顾况,《历代名画记》,卷十 唐朝下,张彦远,,顾况，字逋翁，吴兴人。不修检操，颇好诗咏，善画山水。初为韩晋公江南判官，入为著作佐郎，久次不迁，乃嘲诮宰相，为宪司所劾。贞元五年，贬饶州司户，居茅山以寿终。有《画评》一篇，未为精当也。
lit_4eae8f44,张璪,《历代名画记》,卷十 唐朝下,张彦远,,沈宁，亦善树石、山水，有格律。师张璪而少劣。
lit_8444236e,沈宁,《历代名画记》,卷十 唐朝下,张彦远,,沈宁，亦善树石、山水，有格律。师张璪而少劣。
lit_2cb37382,张通,《历代名画记》,卷十 唐朝下,惆怅赋诗,,刘商，官至检校礼部郎中、汴州观察判官。少年有篇咏高情，工画山水、树石。初师于张璪，后自造真为意。自张贬窜后，尝惆怅赋诗曰：“苔石苍苍临涧水，溪风袅袅动松枝。世间惟有张通会，流向衡阳那得知？”或云，商后得道。
lit_2e26b937,刘商,《历代名画记》,卷十 唐朝下,惆怅赋诗,,刘商，官至检校礼部郎中、汴州观察判官。少年有篇咏高情，工画山水、树石。初师于张璪，后自造真为意。自张贬窜后，尝惆怅赋诗曰：“苔石苍苍临涧水，溪风袅袅动松枝。世间惟有张通会，流向衡阳那得知？”或云，商后得道。
lit_44acfa8e,张璪,《历代名画记》,卷十 唐朝下,惆怅赋诗,,刘商，官至检校礼部郎中、汴州观察判官。少年有篇咏高情，工画山水、树石。初师于张璪，后自造真为意。自张贬窜后，尝惆怅赋诗曰：“苔石苍苍临涧水，溪风袅袅动松枝。世间惟有张通会，流向衡阳那得知？”或云，商后得道。
lit_4164ca13,刘整,《历代名画记》,卷十 唐朝下,张彦远,,刘整，任秘书省正字。善山水，有气象。时有刘之奇，亦能山水。
lit_735f6081,刘整,《历代名画记》,卷十 唐朝下,张彦远,,刘整，担任秘书省正字。善画山水，画作富有气象。当时还有刘之奇，也善画山水。
lit_4b8ff05b,于锡,《历代名画记》,卷十 唐朝下,张彦远,,于锡，善画花鸟及鸡。
lit_a8fb9b47,于锡,《历代名画记》,卷十 唐朝下,张彦远,,于锡，善画花鸟和鸡。
lit_37c2ac51,梁广,《历代名画记》,卷十 唐朝下,张彦远,,梁广，工花鸟，善赋彩，笔迹不及边鸾。
lit_48dfb136,梁广,《历代名画记》,卷十 唐朝下,张彦远,,梁广，精于花鸟画，善着色，但笔法不及边鸾精妙。
lit_d6bb336b,陈庶,《历代名画记》,卷十 唐朝下,张彦远,,陈庶，扬州人。师边鸾花鸟，尤善布色。
lit_43cb920a,陈庶,《历代名画记》,卷十 唐朝下,张彦远,,陈庶，扬州人。师从于边鸾，善于画花鸟，尤其擅长着色。
lit_286cd66f,陈恪,《历代名画记》,卷十 唐朝下,张彦远,,陈恪，工山水，师张、郑，有气韵。人物、鞍马、虫禽并精。子积善，山水妙过于父。一云“陈格”。
lit_95de6df7,戴重席,《历代名画记》,卷十 唐朝下,张彦远,,戴重席，工子女，极精细。
lit_7670e0be,周昉,《历代名画记》,卷十 唐朝下,张彦远,,周昉，字景玄，官至宣州长史。初效张萱画，后则小异，颇极风姿，全法衣冠，不近闾里。衣裳劲简，彩色柔丽。菩萨端严，妙创水月之体。《蜂蝶图》《按筝图》《杨真人》《陆真人图》《五星图》传于代。
lit_0ba79bf5,张萱,《历代名画记》,卷十 唐朝下,张彦远,,周昉，字景玄，官至宣州长史。初效张萱画，后则小异，颇极风姿，全法衣冠，不近闾里。衣裳劲简，彩色柔丽。菩萨端严，妙创水月之体。《蜂蝶图》《按筝图》《杨真人》《陆真人图》《五星图》传于代。
lit_c00d2e02,赵博文,《历代名画记》,卷十 唐朝下,张彦远,,赵博文，尚书左丞涓之子也。画子母犬、兔，善写貌，应进士不第。
lit_d9751264,郑寓,《历代名画记》,卷十 唐朝下,张彦远,,郑寓，善果之后也。学昉画天王、菩萨，有思。
lit_6ba02a8b,韩滉,《历代名画记》,卷十 唐朝下,张彦远,,韩滉，字太冲，官至金紫光禄大夫、浙东西两道节度使、左仆射、同平章事，封晋国公。贞元三年，年六十五，赠太傅，谥忠肃。工隶书、章草，杂画颇得形似，牛羊最佳。
lit_a20b91ca,戴嵩,《历代名画记》,卷十 唐朝下,张彦远,,戴嵩，韩晋公之镇浙右，署为巡官。师晋公之画，不善他物，唯善水牛而已。田家、川原，亦有意。
lit_5a5241eb,李渐,《历代名画记》,卷十 唐朝下,张彦远,,李渐，官至忻州刺史，善蕃人蕃马、骑射、射雕。放牧、川原之妙，笔迹气调，古今亡俦。
lit_14d74d69,萧祐,《历代名画记》,卷十 唐朝下,张彦远,,萧祐，画山水，甚有意思，为桂州观察使。
lit_d46d0047,萧祐,《历代名画记》,卷十 唐朝下,张彦远,,萧祐，所画山水十分有意蕴和思想，任职桂州观察使。
lit_85789e1e,周太素,《历代名画记》,卷十 唐朝下,张彦远,,周太素，终尚书郎。善画花鸟、佛像。
lit_7825e081,周太素,《历代名画记》,卷十 唐朝下,张彦远,,周太素，官至尚书郎。善画花鸟、佛像题材。
lit_734188b9,萧悦,《历代名画记》,卷十 唐朝下,张彦远,,萧悦，协律郎。工竹一色，有雅趣。
lit_5ed6475b,萧悦,《历代名画记》,卷十 唐朝下,张彦远,,萧悦，担任协律郎。专攻画竹，画作有雅趣。
lit_b75bc126,张志和,《历代名画记》,卷十 唐朝下,张彦远,,张志和，字子同，会稽人。性高迈，不拘检，自称“烟波钓徒”，著《玄真子》十卷。书迹狂逸，自为渔歌，便画之，甚有逸思。肃宗朝，官至左金吾卫、录事参军。本名龟龄，诏改之。颜鲁公与之善，陆羽等尝为食客。
lit_8c0283d7,侯莫陈厦,《历代名画记》,卷十 唐朝下,张彦远,,侯莫陈厦，字重构。工山水，用意极精。
lit_60257157,侯莫陈厦,《历代名画记》,卷十 唐朝下,张彦远,,侯莫陈厦，字重构。善画山水，绘画意韵极其精妙。
lit_ed91e449,郑町,《历代名画记》,卷十 唐朝下,张彦远,,会稽僧道芬、郑町处士、荥阳人。梁洽处士，天台项容处士，青州吴恬处士，一名玢，字建康。已上并画山水。道芬格高，郑町淡雅，梁洽美秀，项容顽涩，吴恬险巧。恬有《画山水录》，记平生所画在绢素者，凡百余面，传之好事。自云：“初梦寐有神人指授画法。”恬好为顽石，气象深险；能为云，而气象蓊格。
lit_abac1fff,项容,《历代名画记》,卷十 唐朝下,张彦远,,会稽僧道芬、郑町处士、荥阳人。梁洽处士，天台项容处士，青州吴恬处士，一名玢，字建康。已上并画山水。道芬格高，郑町淡雅，梁洽美秀，项容顽涩，吴恬险巧。恬有《画山水录》，记平生所画在绢素者，凡百余面，传之好事。自云：“初梦寐有神人指授画法。”恬好为顽石，气象深险；能为云，而气象蓊格。
lit_1fbd4d0b,梁洽,《历代名画记》,卷十 唐朝下,张彦远,,会稽僧道芬、郑町处士、荥阳人。梁洽处士，天台项容处士，青州吴恬处士，一名玢，字建康。已上并画山水。道芬格高，郑町淡雅，梁洽美秀，项容顽涩，吴恬险巧。恬有《画山水录》，记平生所画在绢素者，凡百余面，传之好事。自云：“初梦寐有神人指授画法。”恬好为顽石，气象深险；能为云，而气象蓊格。
lit_fd53e849,道芬,《历代名画记》,卷十 唐朝下,张彦远,,会稽僧道芬、郑町处士、荥阳人。梁洽处士，天台项容处士，青州吴恬处士，一名玢，字建康。已上并画山水。道芬格高，郑町淡雅，梁洽美秀，项容顽涩，吴恬险巧。恬有《画山水录》，记平生所画在绢素者，凡百余面，传之好事。自云：“初梦寐有神人指授画法。”恬好为顽石，气象深险；能为云，而气象蓊格。
lit_131abf8a,吴恬,《历代名画记》,卷十 唐朝下,张彦远,,会稽僧道芬、郑町处士、荥阳人。梁洽处士，天台项容处士，青州吴恬处士，一名玢，字建康。已上并画山水。道芬格高，郑町淡雅，梁洽美秀，项容顽涩，吴恬险巧。恬有《画山水录》，记平生所画在绢素者，凡百余面，传之好事。自云：“初梦寐有神人指授画法。”恬好为顽石，气象深险；能为云，而气象蓊格。
lit_be3ef913,项容,《历代名画记》,卷十 唐朝下,张彦远,,王默，师项容，风颠酒狂。画松石、山水，虽乏高奇，流俗亦好。醉后以头髻取墨，抵于绢画。王默早年授笔法于台州郑广文虔。贞元末，于润州殁，举柩若空，时人皆云化去。平生大有奇事，顾著作知新亭监时，默请为海中都巡，问其意，云“要见海中山水耳”。为职半年，解去。尔后落笔有奇趣，顾生乃其弟子耳。彦远从兄监察御史厚，与余具道此事，然余不甚觉默画有奇。
lit_57bd04fd,王默,《历代名画记》,卷十 唐朝下,张彦远,,王默，师项容，风颠酒狂。画松石、山水，虽乏高奇，流俗亦好。醉后以头髻取墨，抵于绢画。王默早年授笔法于台州郑广文虔。贞元末，于润州殁，举柩若空，时人皆云化去。平生大有奇事，顾著作知新亭监时，默请为海中都巡，问其意，云“要见海中山水耳”。为职半年，解去。尔后落笔有奇趣，顾生乃其弟子耳。彦远从兄监察御史厚，与余具道此事，然余不甚觉默画有奇。
