lit_id,target_ref,source_book,source_chapter,author_ref,quality_rank,source_text
lit_46984a32,谢稚,《历代名画记》,卷五 晋,张彦远,下品,谢稚，下品。陈郡阳夏人。初为晋司徒主簿，入宋为宁朔将军、西阳太守。宋《邓琬传》。有《稚子》《列女》《康侯像》《列女母仪图》《列女贞节图》《列女贤明图》《列女仁智图》《列女传》一、《游仙翡翠篇》《列女辩通图》《三马伯乐图》《㶉鶒图》《孝子图》《十弟子图》《三牛图》《濠梁图》《轻车迅迈图》《列女画》《秋兴图》《孝经图》《列女图》《大列女图》《康侯图》《晋宣王及魏名臣图》、杂画一、《楚令尹泣岐蛇图》《孟母图》《游仙图》《秦王游海图》《洛阳门翻车并水图》《汾阴醮鼎图》《狩河阳图》，并传于代。
lit_0ba86657,戴逵,《历代名画记》,卷五 晋,张彦远,,夏侯瞻，下品。谢云：“气韵不足，精密有余。擅名当代，事非虚美。”在第三品毛惠远下、戴逵上。《郢匠图》《高士图》《倕山图》《楚人祠鬼神图》传于代。
lit_f7f062ab,毛惠远,《历代名画记》,卷五 晋,张彦远,,夏侯瞻，下品。谢云：“气韵不足，精密有余。擅名当代，事非虚美。”在第三品毛惠远下、戴逵上。《郢匠图》《高士图》《倕山图》《楚人祠鬼神图》传于代。
lit_06b6747a,夏侯瞻,《历代名画记》,卷五 晋,张彦远,下品,夏侯瞻，下品。谢云：“气韵不足，精密有余。擅名当代，事非虚美。”在第三品毛惠远下、戴逵上。《郢匠图》《高士图》《倕山图》《楚人祠鬼神图》传于代。
lit_17c12b20,嵇康,《历代名画记》,卷五 晋,张彦远,,嵇康，字叔夜，谯国铚人。能属词，善鼓琴，工书画，美风仪。在魏拜中散大夫，入晋不仕。自以高洁难期，所与神交者，唯王戎、山涛等，为“竹林七贤”而已。性巧绝，与向秀共锻于柳树下。锺会，贵公子也，往访之，康不礼焉。会构祸康于文帝，时年四十。见《晋书》。《狮子击象图》《巢由图》传于代。
lit_eca717a0,王濛,《历代名画记》,卷五 晋,张彦远,,王濛，字仲祖，晋阳人。放诞不羁，书比庾翼，丹青甚妙，颜希高达。常往驴肆家画轜车。自云：“我嗜酒，好肉，善画，但人有饮食、美酒、精绢，我何不往也！”特善清言，为时所重。卒时年三十九。官至司徒左长史。《晋书》有传，事见《中兴书》。
lit_774f5403,戴逵,《历代名画记》,卷五 晋,长史见之,,戴逵，字安道，谯郡铚人。幼有巧慧，聪悟博学，善鼓琴，工书画。为童儿时，以白瓦屑、鸡卵汁和溲作小碑子，为《郑玄碑》，时称“词美书精，器度巧绝”。其画古人山水极妙。十余岁时，于瓦棺寺中画，王长史见之云：“此儿非独能画，终享大名，吾恨不得见其盛时。”逵尝就范宣学，范见逵画，以为亡用之事，不宜虚劳心思。逵乃与宣画《南都赋》，范观毕，嗟叹，甚以为有益，乃亦学画。逵既巧思，又善铸佛像及雕刻。曾造无量寿木像，高丈六，并菩萨。逵以古制朴拙，至于开敬，不足动心，乃潜坐帷中，密听众论。所听褒贬，辄加详研，积思三年，刻像乃成。迎至山阴灵宝寺，郗超观而礼之，撮香誓曰（云云）。既而手中香勃然烟上，极目云际。前后征拜，终不起。太元二十一年也。见《晋书》、及《宋书》、及《逵别传》、徐广《晋记》《会稽记》《郭子》、刘义庆《世说》、宋朝《临川玉冥验记》。此像今在越州嘉祥寺。今亦有逵手铸铜佛并二菩萨，在故洛阳城白马寺，隋文帝自荆南兴皇寺取来。
lit_3f58eaba,戴逵,《历代名画记》,卷五 晋,张彦远,,负石自沉于泸水。见《列仙传》。戴逵画，有《阿谷处女图》《孙绰高士像》《胡人弄猿画》《濠梁图》《董威辇诗图》《孔子弟子图》《金人铭》《三马伯乐图》《三牛图》《尚子平》（白画）、《嵇阮像》《嵇阮十九首诗图》《五天罗汉图》《名马图》《渔父图》《狮子图》《吴中溪山邑居图》《杜征南人物图》，并传前代。
lit_343086d4,陆探微,《历代名画记》,卷六 宋,张彦远,上品上,陆探微，上品上。吴人也。宋明帝时常在侍从。丹青之妙，最推工者。《宋书》有名。
lit_b63e12c4,陆探微,《历代名画记》,卷六 宋,谢赫评,,谢赫评云：“画有六法，自古作者鲜能备之，唯陆探微及卫协备之矣。穷理尽性，事绝言象。包前孕后，古今独立。非激扬可至，铨量之极乎。上品之上，亡地寄言，故居标第一。”第一品第一人。
lit_b622d989,卫协,《历代名画记》,卷六 宋,谢赫评,,谢赫评云：“画有六法，自古作者鲜能备之，唯陆探微及卫协备之矣。穷理尽性，事绝言象。包前孕后，古今独立。非激扬可至，铨量之极乎。上品之上，亡地寄言，故居标第一。”第一品第一人。
lit_393681c6,荀勖,《历代名画记》,卷六 宋,李嗣真,,李嗣真云：“‘亡地寄言，故居标第一’，此言过当。但顾长康之迹，可使陆君失步，荀勖绝倒。然则称万代蓍龟衡镜者，顾、陆同居上品第一。”
lit_dac08221,方之绥,《历代名画记》,卷六 宋,张彦远,,顾宝光，中品上。吴郡人。善书画。大明中为尚书、水部郎。见《宋书·陆探微传》云，司徒左曹掾。谢云：“全法陆家，事事宗禀。方之绥、倩则优。”在第四品蘧道愍下，王维、史道硕上。《射雉图》《豫章王像》《泰始名臣图》《宋竟陵王像》《瑾公像》《㶉鶒图》《张兴像》《泰始勋臣像》《王翼之像》《勋贤像》《褚渊衣架图》《天竺僧》（麻纸画）、《洛中车马斗鸡图》《越中风俗图》，并传于世。
lit_2889b8c6,顾宝光,《历代名画记》,卷六 宋,张彦远,中品上,顾宝光，中品上。吴郡人。善书画。大明中为尚书、水部郎。见《宋书·陆探微传》云，司徒左曹掾。谢云：“全法陆家，事事宗禀。方之绥、倩则优。”在第四品蘧道愍下，王维、史道硕上。《射雉图》《豫章王像》《泰始名臣图》《宋竟陵王像》《瑾公像》《㶉鶒图》《张兴像》《泰始勋臣像》《王翼之像》《勋贤像》《褚渊衣架图》《天竺僧》（麻纸画）、《洛中车马斗鸡图》《越中风俗图》，并传于世。
lit_ce61a26c,陆探微,《历代名画记》,卷六 宋,张彦远,,顾宝光，中品上。吴郡人。善书画。大明中为尚书、水部郎。见《宋书·陆探微传》云，司徒左曹掾。谢云：“全法陆家，事事宗禀。方之绥、倩则优。”在第四品蘧道愍下，王维、史道硕上。《射雉图》《豫章王像》《泰始名臣图》《宋竟陵王像》《瑾公像》《㶉鶒图》《张兴像》《泰始勋臣像》《王翼之像》《勋贤像》《褚渊衣架图》《天竺僧》（麻纸画）、《洛中车马斗鸡图》《越中风俗图》，并传于世。
lit_6635a1c5,史道硕,《历代名画记》,卷六 宋,张彦远,,顾宝光，中品上。吴郡人。善书画。大明中为尚书、水部郎。见《宋书·陆探微传》云，司徒左曹掾。谢云：“全法陆家，事事宗禀。方之绥、倩则优。”在第四品蘧道愍下，王维、史道硕上。《射雉图》《豫章王像》《泰始名臣图》《宋竟陵王像》《瑾公像》《㶉鶒图》《张兴像》《泰始勋臣像》《王翼之像》《勋贤像》《褚渊衣架图》《天竺僧》（麻纸画）、《洛中车马斗鸡图》《越中风俗图》，并传于世。
lit_b39e8357,王维,《历代名画记》,卷六 宋,张彦远,,顾宝光，中品上。吴郡人。善书画。大明中为尚书、水部郎。见《宋书·陆探微传》云，司徒左曹掾。谢云：“全法陆家，事事宗禀。方之绥、倩则优。”在第四品蘧道愍下，王维、史道硕上。《射雉图》《豫章王像》《泰始名臣图》《宋竟陵王像》《瑾公像》《㶉鶒图》《张兴像》《泰始勋臣像》《王翼之像》《勋贤像》《褚渊衣架图》《天竺僧》（麻纸画）、《洛中车马斗鸡图》《越中风俗图》，并传于世。
lit_4e97b4ca,宗炳,《历代名画记》,卷六 宋,张彦远,中品中,宗炳，字少文，中品中。南阳涅阳人。善书画。江夏王义恭尝荐炳于宰相，前后辟召，竟不就。善琴书，好山水。西陟荆、巫，南登衡岳，因结宇衡山，怀尚平之志。以疾还江陵，叹曰：“噫！老病俱至，名山恐难遍游，唯当澄怀观道，卧以游之。”凡所游历，皆图于壁，坐卧向之，其高情如此。年六十九。
lit_5b0974c8,王微,《历代名画记》,卷六 宋,人何偃书,下品,王微，字景玄，下品。琅琊临沂人。善书画。尝居一屋，读书玩古，不出十余年。与友人何偃书曰：“吾性知画，盖鸣鹄识夜之机。盘纡纠纷，咸纪心目。故山水之好，一往迹求，皆得仿佛。”竟不就辟。世祖以贞栖绝俗，赠秘书监。
lit_7da19eab,谢庄,《历代名画记》,卷六 宋,张彦远,,谢庄，字希逸，陈郡阳夏人。幼有才学，初为始兴王濬后军参军。性多巧思，善画。制木方丈，图天下山川、土地，各有分理。离之则州、郡殊，合之则宇内为一。作《画琴帖序》，自序其画云。泰始二年卒。官至光禄大夫、散骑常侍兼中书令。年四十六。赠右光禄大夫，谥宪子。见《宋书》，又《庄集》。
lit_36fd3ea0,袁倩,《历代名画记》,卷六 宋,张彦远,中品上,袁倩。中品上。谢云：“北面陆氏，最为高足。象人之妙，亚美前修。但守师法，不出新意。其于妇人，特为古拙。”在第二品陆绥下，姚昙度上。《徐令》（麻纸）、《豫章王像》《张畅等像》《王抗棋图》《会献图》《正声伎图》《御临轩图》《朝臣十二人图》《吴楚夜踏歌图》《豫章王宴宾图》《天女》（白画）、《东晋高僧》（白画）、《二龙图》《貌三人像》（不题名字），并冠武弁，有太清年月，并行于世。又《维摩诘变》一卷，百有余事，运思高妙，“六法”备呈，置位无差。若神灵感会，精光指顾，得瞻仰威容，前使顾、陆知惭，后得张、阎骇叹。又有《苍梧图》，传于前代也。
lit_3740f991,史敬文,《历代名画记》,卷六 宋,张彦远,中品上,史敬文。中品上。《黄帝升仙图》《梁冀人马画》《张平子西京赋图》，并传于代。
lit_d7a54a78,史敬文,《历代名画记》,卷六 宋,张彦远,中品上,史敬文。中品上。作品有《黄帝升仙图》《梁冀人马画》《张平子西京赋图》，均流传于世。
lit_1c817dc7,史艺,《历代名画记》,卷六 宋,张彦远,下品,史艺。下品。《屈原渔父图》《王羲之像》《孙绰像》，并传于代。
lit_1e84d15a,王羲之,《历代名画记》,卷六 宋,张彦远,,史艺。下品。《屈原渔父图》《王羲之像》《孙绰像》，并传于代。
lit_287405e9,刘斌,《历代名画记》,卷六 宋,张彦远,下品,刘斌。下品。《诗·黍离图》传于代。
lit_b951f485,刘斌,《历代名画记》,卷六 宋,张彦远,下品,刘斌。下品。作品有《诗经·黍离图》流传于世。
lit_1166a201,尹长生,《历代名画记》,卷六 宋,张彦远,下品,尹长生。下品。或作“尹扈生”。《骆简像》《山阴公主像》《南朝贵戚图》《车马图》传于世。
lit_08c62681,顾骏之,《历代名画记》,卷六 宋,张彦远,中品,顾骏之。中品。严公等像并传于代。
lit_968c911d,顾骏之,《历代名画记》,卷六 宋,张彦远,中品,顾骏之。中品。作品有严公等像流传于世。
lit_3ce35403,吴暕,《历代名画记》,卷六 宋,张彦远,下品,吴暕。下品。谢云：“体法雅媚，制置才巧。擅美当年，有声京洛。”在第二品江僧宝下。
lit_704893d7,张则,《历代名画记》,卷六 宋,张彦远,下品,张则。下品。谢云：“意态宏逸，动笔新奇。”在吴暕下。
lit_0f3d339c,吴暕,《历代名画记》,卷六 宋,张彦远,,张则。下品。谢云：“意态宏逸，动笔新奇。”在吴暕下。
lit_50f214f6,刘胤祖,《历代名画记》,卷六 宋,张彦远,下品,刘胤祖，下品。官至尚书吏部郎。谢云：“蝉雀特尽微妙，笔迹超越，爽俊不凡。”在第三品晋明帝下。
lit_dce76d81,蔡斌,《历代名画记》,卷六 宋,张彦远,下品下,蔡斌。下品下。《游仙图》《苏武像》，并传于代。
lit_19481128,蔡斌,《历代名画记》,卷六 宋,张彦远,下品下,蔡斌。下品下。作品有《游仙图》《苏武像》，皆流传于世。
lit_c8bd1bde,史粲,《历代名画记》,卷六 宋,张彦远,中品上,史粲。中品上。《马势》（白画）、《八骏图》传于代。
lit_9daa8878,史粲,《历代名画记》,卷六 宋,张彦远,中品上,史粲。中品上。作品有《马势》（白画）、《八骏图》流传于世。
lit_a751801a,褚灵石,《历代名画记》,卷六 宋,张彦远,下品,褚灵石。下品。
lit_8dea618f,宗测,《历代名画记》,卷七 南齐,测答,,宗测，字敬微，炳之孙也。炳，已具第六卷。代居江陵，不应辟召。骠骑将军豫章王嶷请为参军，测答曰：“得何谬伤海鸟，横斤山木？”性善书画，传其祖业，志欲游名山，乃写祖炳所画《尚子平图》于壁。隐庐山，居炳旧宅，画《阮籍遇孙登》于行障上，坐卧对之。又画永业寺佛影台，皆称臻绝。见《南齐记》。
lit_79f0c5ae,刘系宗,《历代名画记》,卷七 南齐,张彦远,,刘系宗，丹阳人。少便书画，在宋为景陵王子景粹侍书，入齐为东宫侍书，官至骠骑将军、宣城太守。《南齐书》具载。
lit_594c54a1,章继伯,《历代名画记》,卷七 南齐,张彦远,下品,章继伯。下品。谢云：“与蘧同品。”《藉田图》，绢，长三丈，传于代。
lit_33d8ffff,章继伯,《历代名画记》,卷七 南齐,张彦远,下品,章继伯。下品。谢赫说：“与蘧道愍同一个品第。”作品有《籍田图》，绢画，长三丈，流传于世。
lit_befb3e36,范怀珍,《历代名画记》,卷七 南齐,张彦远,中品,范怀珍。中品。或作“怀粲”，或作“怀坚”。《渥洼马图》《孝子》（屏风）行于代。
lit_9cf90e99,王奴,《历代名画记》,卷七 南齐,张彦远,下品,王奴。下品。《啸赋图》，行于代。
lit_0c2ce8c7,王奴,《历代名画记》,卷七 南齐,张彦远,下品,王奴。下品。作品有《啸赋图》流传于世。
lit_b18b4a2b,王殿,《历代名画记》,卷七 南齐,张彦远,下品,王殿。下品。《曹长孺真》《列女传》《母仪图》《三马图》《败春图》传于代。
lit_880cf713,王殿,《历代名画记》,卷七 南齐,张彦远,下品,王殿。下品。作品有《曹长孺真》《列女传》《母仪图》《三马图》《败春图》流传于世。
lit_065c3bb8,戴蜀,《历代名画记》,卷七 南齐,张彦远,中品下,戴蜀。中品下。《孝子图》《息妫图》传于代。
lit_1c650ece,戴蜀,《历代名画记》,卷七 南齐,张彦远,中品下,戴蜀。中品下。戴蜀有作品《孝子图》《息妫图》流传于世。
lit_fabc8829,陈公恩,《历代名画记》,卷七 南齐,张彦远,下品,陈公恩。下品。《列女贞节图》《列女仁智图》《朱买臣图》传于代。
lit_776d0afc,陈公恩,《历代名画记》,卷七 南齐,张彦远,下品,陈公恩。下品。作品有《列女贞节图》《列女仁智图》《朱买臣图》流传于世。
lit_26453017,张季和,《历代名画记》,卷七 南齐,张彦远,下品,张季和。下品。《游清池图》传于代。
lit_0de35b9e,张季和,《历代名画记》,卷七 南齐,张彦远,下品,张季和。下品。作品有《游清池图》流传于世。
lit_0c5f88c2,沈标,《历代名画记》,卷七 南齐,姚最,下品,沈标。下品。姚最云：“亡所偏善，触类涉习，留意铅华，亦有可观。”
lit_bf30f29d,沈标,《历代名画记》,卷七 南齐,张彦远,下品,沈标。下品。姚最说：“沈标作画并不十分擅长做某一类，各种画法他都有所涉猎，但相对侧重女子画像，作品也有可观之处。”
lit_ccf83fa1,沈标,《历代名画记》,卷七 南齐,姚最,,谢赫。中品下。姚最云：“点刷精研，意存形似。写貌人物，不俟对看，所须一览，便归操笔。目想毫发，皆亡遗失。丽服靓妆，随时变改，直眉曲鬓，与时竞新。别体细微，多从赫始。遂使委巷逐末，皆类效颦。至于气韵精灵，未穷生动之致；笔路纤弱，不副雅壮之怀。然中兴已来，象人为最。”在沈标下，毛惠秀上。《安期先生图》传于代。
lit_e6825920,沈粲,《历代名画记》,卷七 南齐,姚最,下品,沈粲。下品。姚最云：“笔迹调媚，专工绮罗。屏障所图，颇有情趣。”在张僧繇上。彦远云：“专工绮罗，亡所他善，不合在僧繇上。”
lit_a4c7c387,丁光,《历代名画记》,卷七 南齐,”彦远,,丁光。谢云：“虽擅名蝉雀，笔迹轻羸，非不精谨，乏其生气。”彦远云：“若以蝉、雀微艺，况又轻羸，则猥厕画流，固有惭色。”
lit_d149e6f2,周昙研,《历代名画记》,卷七 南齐,沙门彦悰,,周昙研。沙门彦悰云：“师塞北勤，授曹仲达，比曹不足，方塞有余。”塞北勤，未详。
lit_f25a829d,曹仲达,《历代名画记》,卷七 南齐,沙门彦悰,,周昙研。沙门彦悰云：“师塞北勤，授曹仲达，比曹不足，方塞有余。”塞北勤，未详。
lit_ce706b06,谢惠连,《历代名画记》,卷七 南齐,张彦远,中品中,谢惠连，中品中。陈郡阳夏人。幼有词学，族兄灵运叹服之。官至司徒府参军，以疏放久不从宦。年二十，书画并妙。《南齐书》具载。
lit_7261ea14,谢约,《历代名画记》,卷七 南齐,孙畅之,下品,谢约。下品。孙畅之云：“综弟也，为卫尉参军，范晔为传。善山水。”《大山图》并《声妓乐器图》传于代。
lit_82c4d2a2,丁宽,《历代名画记》,卷七 南齐,张彦远,下品,丁宽。下品。
lit_1a277a4a,刘瑱,《历代名画记》,卷七 南齐,张彦远,下品,刘瑱，字士温，下品，彭城人。少聪慧，多才艺，工书画。饮酒至数斗。画嫔嫱，当代第一。官至吏部郎。见《南齐书》。
lit_10a0a4fd,刘瑱,《历代名画记》,卷七 南齐,张彦远,下品,刘瑱，字士温，下品。彭城人。少年时聪慧机敏，多才多艺，精通书法绘画。酒量之大能够多达数斗。他画贵族女子在当时堪称第一。官至吏部郎。传记见于《南齐书》。
lit_429b6528,毛惠远,《历代名画记》,卷七 南齐,张彦远,中品上,毛惠远，中品上。荥阳阳武人。善画马。时刘瑱善画妇人，并当代第一。官至少府卿，市青碧一千二百斤，供御画，用钱六十五万。有言惠远纳利者，世祖敕尚书评价，贵二十八万，杀之。后家徒壁立，上悔痛之。见萧子显《齐书》。
lit_c0da3d15,刘瑱,《历代名画记》,卷七 南齐,张彦远,,毛惠远，中品上。荥阳阳武人。善画马。时刘瑱善画妇人，并当代第一。官至少府卿，市青碧一千二百斤，供御画，用钱六十五万。有言惠远纳利者，世祖敕尚书评价，贵二十八万，杀之。后家徒壁立，上悔痛之。见萧子显《齐书》。
lit_594d844b,萧大连,《历代名画记》,卷七 梁,张彦远,,萧大连，字仁靖，简文帝第五子。少俊爽风流，有巧思，洞达音律，工丹青。初封临海县公，官至东扬州刺史、轻车将军。大宝元年，封南郡王，年二十五。见《梁书》。
lit_3ad34784,萧贲,《历代名画记》,卷七 梁,张彦远,下品,萧贲，字文奂，下品。兰陵人。多词学，工书画。曾于扇上画山水，咫尺内万里可知。仕梁，为河东太守。见《梁书》。
lit_b30da031,陆杲,《历代名画记》,卷七 梁,张彦远,中品上,陆杲，字明霞，中品上。吴郡人也。好词学，信佛理，工书画，与舅张融齐名。初仕齐，后入梁，官至特进、扬州大中正。见《梁书》。
lit_37b18227,袁昂,《历代名画记》,卷七 梁,张彦远,中品上,袁昂，字千里，中品上。陈郡阳夏人。仕齐，为秘监、黄门侍郎。幼以孝称，颇善画。入梁，官至中书监。年八十，赠侍中、特进，谥曰穆正。见《梁书》。
lit_ea2f3e6f,袁昂,《历代名画记》,卷七 梁,张彦远,中品上,袁昂，字千里，中品上。陈郡阳夏人。在南齐时任官秘书监、黄门侍郎。幼年时即以孝顺著称，非常善于作画。入梁后，官至中书监。享年八十岁，死后追赠侍中、特进，谥号为穆正。事迹见于《梁书》。
lit_fed5adbf,嵇宝钧,《历代名画记》,卷七 梁,姚最,,焦宝愿。下品。姚最云：“早游张、谢，靳固不传。傍求造请，事均盗道。衣制树色，皆自新意；点黛施朱，轻重不失。”在毛稜上，嵇宝钧下。
lit_b846e145,毛稜,《历代名画记》,卷七 梁,姚最,,焦宝愿。下品。姚最云：“早游张、谢，靳固不传。傍求造请，事均盗道。衣制树色，皆自新意；点黛施朱，轻重不失。”在毛稜上，嵇宝钧下。
lit_b3348710,焦宝愿,《历代名画记》,卷七 梁,姚最,下品,焦宝愿。下品。姚最云：“早游张、谢，靳固不传。傍求造请，事均盗道。衣制树色，皆自新意；点黛施朱，轻重不失。”在毛稜上，嵇宝钧下。
lit_55ef2eed,嵇宝钧,《历代名画记》,卷七 梁,姚最,下品,嵇宝钧。下品。姚最云：“虽亡师范，而意兼真俗。赋彩鲜丽，观之悦情。”彦远以画性所贵天然，何必师范？
lit_a3191b06,聂松,《历代名画记》,卷七 梁,梁帝,下品,聂松。下品。梁帝云：“与嵇同品，言其优劣，僧繇之亚。”在解倩上。《支道林像》传于代。
lit_639da76b,解倩,《历代名画记》,卷七 梁,梁帝,,聂松。下品。梁帝云：“与嵇同品，言其优劣，僧繇之亚。”在解倩上。《支道林像》传于代。
lit_eb3e20df,解倩,《历代名画记》,卷七 梁,姚最,中品下,解倩。中品下。姚最云：“全法蘧、章，笔力不及，通变巧捷，寺壁最长。”《丁贵人弹曲项琵琶图》《五天人像》《九子魔图》传于代。
lit_e1c4791d,陆整,《历代名画记》,卷七 梁,张彦远,中品上,陆整。中品上。《御像》传于代。
lit_48539bb7,陆整,《历代名画记》,卷七 梁,张彦远,中品上,陆整。中品上。有《御像》流传于世。
lit_09af83b6,戴逵,《历代名画记》,卷七 梁,谢赫,,江僧宝。中品下。谢赫云：“斟酌袁、陆，亲渐朱蓝。用笔骨鲠，甚有师法。象人外，亡所长。”在第三品戴逵下，吴暕上。《临轩图》《御像》《职贡图》《小儿戏鹅图》，并有陈朝年号，传于代。
lit_c7871f0e,吴暕,《历代名画记》,卷七 梁,谢赫,,江僧宝。中品下。谢赫云：“斟酌袁、陆，亲渐朱蓝。用笔骨鲠，甚有师法。象人外，亡所长。”在第三品戴逵下，吴暕上。《临轩图》《御像》《职贡图》《小儿戏鹅图》，并有陈朝年号，传于代。
lit_2037998a,顾野王,《历代名画记》,卷八 陈,张彦远,,顾野王，字希冯，吴郡人。七岁通“五经”，善属词，能书画。长为鸿儒，天象、地理，无不毕习。在梁为中领军。时宣城王为扬州，野王善画，王褒善书，俱为宾友，时号“二绝”。入陈，官至黄门侍郎，年六十三，赠右卫将军。见《陈书》。
lit_13840eb0,蒋少游,《历代名画记》,卷八 后魏,张彦远,,蒋少游，乐安博昌人。敏慧机巧，工书画，善画人物及雕刻。虽有才学，常在剞劂绳墨之间，园湖城殿之侧，识者叹息。少游坦然以为己任，不告疲劳。官至将作大匠、太常少卿、前将军、都水，兼此四官。赠龙骧将军、青州刺史，谥曰质。见《后魏书》。时有郭善明、侯文和、柳俭、闵文和、郭道兴，并以巧思称。
lit_3f1c97b0,杨乞德,《历代名画记》,卷八 后魏,张彦远,,杨乞德，封新乡侯。归心释门，施身入寺。善画佛像，价凌昙度。
lit_3ebeb381,王由,《历代名画记》,卷八 后魏,张彦远,,王由，字茂道。善书画，摹画佛像，为时所服。官至东莱太守。见《后魏书》。
lit_10d42510,高孝珩,《历代名画记》,卷八 北齐,张彦远,,高孝珩，世宗第二子，封广宁郡王、尚书令、大司徒、司州牧。博涉多才艺。尝于厅事壁上画苍鹰，睹者疑其真，鸠、雀不敢近。又画《朝士图》，当时绝妙。为周师所虏，授开封县侯。孝珩亦善音律，周武宴齐君臣，自弹琵琶，命孝珩吹笛。见《北齐书》。
